{
    "$schema": "https://json-schema.org/draft/2020-12/schema",
    "title": "Play Script",
    "type": "object",
    "properties": {
      "playTitle": {
        "type": "string",
        "description": "The title of the play"
      },
      "author": {
        "type": "string",
        "description": "The author of the play"
      },
      "description": {
        "type": "string",
        "description": "A brief description of the play"
      },
      "acts": {
        "type": "array",
        "description": "List of acts in the play",
        "items": {
          "type": "object",
          "properties": {
            "actNumber": {
              "type": "integer",
              "description": "The number of the act"
            },
            "actTitle": {
              "type": "string",
              "description": "The title of the act"
            },
            "scenes": {
              "type": "array",
              "description": "List of scenes in the act",
              "items": {
                "type": "object",
                "properties": {
                  "sceneNumber": {
                    "type": "integer",
                    "description": "The number of the scene"
                  },
                  "sceneTitle": {
                    "type": "string",
                    "description": "The title of the scene"
                  },
                  "setting": {
                    "type": "string",
                    "description": "The setting of the scene"
                  },
                  "lines": {
                    "type": "array",
                    "description": "List of lines in the scene",
                    "items": {
                      "type": "object",
                      "properties": {
                        "actor": {
                          "type": "string",
                          "description": "The actor delivering the line"
                        },
                        "text": {
                          "type": "string",
                          "description": "The spoken dialogue"
                        },
                        "stageDirections": {
                          "type": ["string", "null"],
                          "description": "Optional stage directions for an actor"
                        }
                      }
                    }
                  }
                },
                "required": ["sceneNumber", "sceneTitle", "setting", "lines"]
              }
            }
          },
          "required": ["actNumber", "actTitle", "scenes"]
        }
      }
    },
    "required": ["playTitle", "author", "description", "acts"]
  }